{
    "client_id": "kasasagi",
    "obligation_id": "01K63Z9W3V8Q7X1M5N2B4C6D8E",
    "document": {
        "number": "P-4711.1",
        "date": "2026-09-23",
        "due_date": null,
        "currency": "DKK",
        "amount_net": "9030.00",
        "vat_amount": "2257.00",
        "vat_free_amount": "0.00",
        "amount_gross": "11287.50"
    },
    "vat_treatment": "domestic",
    "supplier": {
        "supplier_id": "1042",
        "name": "Eksempel Møbler A/S",
        "vat_number": "DK12345678",
        "country": "DK"
    },
    "lines": [
        {
            "description": "Reol 38, hvid",
            "quantity": "1",
            "unit_price": "6860.00",
            "amount": "6860.00",
            "item_number": "REOL-38",
            "ean": "5700000000017",
            "purchase_order_id": "PO-29800",
            "purchase_order_line_id": "PO-29800-1"
        },
        {
            "description": "Skænk 30, hvid",
            "quantity": "1",
            "unit_price": "2170.00",
            "amount": "2170.00",
            "item_number": "SKAENK-30",
            "ean": "5700000000024",
            "purchase_order_id": "PO-29800",
            "purchase_order_line_id": "PO-29800-5"
        }
    ],
    "approval": {
        "approved_by": "indkoeb@kasasagi.dk",
        "approved_at": "2026-09-24T09:15:00Z"
    },
    "document_file": {
        "url": "https://admin.dreamshop.example/kaikei/documents/01K63Z9W3V8Q7X1M5N2B4C6D8E",
        "sha256": "9f86d081884c7d659a2feaa0c55ad015a3bf4f1b2b0b822cd15d6c15b0f00a08",
        "mimetype": "application/pdf",
        "filename": "proforma-P-4711.1.pdf",
        "size_bytes": 184233
    }
}
